{
  "schema_version": 1,
  "manifest_version": "1.0.0",
  "manifest_id": "mocc.validation.unseen_batch_1",
  "freeze_id": "mocc.freeze.protocols_rules.2026_07_22",
  "dataset_split": "validation",
  "label_visibility": "blind",
  "protocol_revision_policy": "frozen_before_label_access",
  "construction_overlap_policy": "reject_version_path_function_overlap",
  "samples": [
    {
      "sample_id": "mocc.validation.a.ext4_fc_replay_create.v7_1",
      "protocol_id": "mocc.protocol_a.replay_recovery",
      "candidate_rule_ids": ["mocc.rule.replay.ext4.required_step_outcome"],
      "filesystem": "ext4",
      "source_version": "7.1",
      "source_path": "linux-sources/linux-v7.1-fs/fs/ext4/fast_commit.c",
      "source_sha256": "c770fb38732de15b41f8fd264e24f494f6eb600bafbaa1ee7a5d67938a91fe4b",
      "functions": ["ext4_fc_replay_create"],
      "selection_kind": "near_neighbor",
      "selection_rationale": "Unseen ext4 replay function in a pinned later source tree; same protocol family, different entry function from construction locators.",
      "label_status": "unlabeled",
      "reviewer_slots": ["reviewer_a", "reviewer_b"],
      "allowed_verdicts": ["legal", "violation", "analysis_unknown", "out_of_scope"]
    },
    {
      "sample_id": "mocc.validation.a.ext4_fc_replay_link.v7_1",
      "protocol_id": "mocc.protocol_a.replay_recovery",
      "candidate_rule_ids": ["mocc.rule.replay.ext4.required_step_outcome"],
      "filesystem": "ext4",
      "source_version": "7.1",
      "source_path": "linux-sources/linux-v7.1-fs/fs/ext4/fast_commit.c",
      "source_sha256": "c770fb38732de15b41f8fd264e24f494f6eb600bafbaa1ee7a5d67938a91fe4b",
      "functions": ["ext4_fc_replay_link"],
      "selection_kind": "near_neighbor",
      "selection_rationale": "Unseen ext4 replay function selected before labels are available; shares the replay family but not a construction function identity.",
      "label_status": "unlabeled",
      "reviewer_slots": ["reviewer_a", "reviewer_b"],
      "allowed_verdicts": ["legal", "violation", "analysis_unknown", "out_of_scope"]
    },
    {
      "sample_id": "mocc.validation.a.xfs_rtmount_inodes.v7_1",
      "protocol_id": "mocc.protocol_a.replay_recovery",
      "candidate_rule_ids": ["mocc.rule.replay.xfs.ensure_sentinel"],
      "filesystem": "xfs",
      "source_version": "7.1",
      "source_path": "linux-sources/linux-v7.1-fs/fs/xfs/xfs_rtalloc.c",
      "source_sha256": "cb5c6c4a7685716a0e0dd948b11f63ea8bdc4a83c4be575e51e16c94476b3da6",
      "functions": ["xfs_rtmount_inodes"],
      "selection_kind": "near_neighbor",
      "selection_rationale": "Unseen XFS realtime inode caller in the same pinned file as the sentinel evidence, separated from construction function xfs_rtginode_ensure.",
      "label_status": "unlabeled",
      "reviewer_slots": ["reviewer_a", "reviewer_b"],
      "allowed_verdicts": ["legal", "violation", "analysis_unknown", "out_of_scope"]
    },
    {
      "sample_id": "mocc.validation.b.btrfs_setup_sprout.v6_14",
      "protocol_id": "mocc.protocol_b.device_topology_rollback",
      "candidate_rule_ids": ["mocc.rule.topology.sprout_multi_effect_rollback"],
      "filesystem": "btrfs",
      "source_version": "6.14",
      "source_path": "linux-sources/linux-v6.14-fs/fs/btrfs/volumes.c",
      "source_sha256": "9ee648d8d4c8a41fb702b4a94ce4b0c7e389f864dc7b5ec272d054135254ebaa",
      "functions": ["btrfs_setup_sprout"],
      "selection_kind": "near_neighbor",
      "selection_rationale": "Unseen btrfs sprout helper in the rule-supported v6.14 tree; function identity differs from construction locator btrfs_init_new_device.",
      "label_status": "unlabeled",
      "reviewer_slots": ["reviewer_a", "reviewer_b"],
      "allowed_verdicts": ["legal", "violation", "analysis_unknown", "out_of_scope"]
    },
    {
      "sample_id": "mocc.validation.b.btrfs_reloc_post_snapshot.v6_14",
      "protocol_id": "mocc.protocol_b.device_topology_rollback",
      "candidate_rule_ids": ["mocc.rule.topology.relocation_root_rollback"],
      "filesystem": "btrfs",
      "source_version": "6.14",
      "source_path": "linux-sources/linux-v6.14-fs/fs/btrfs/relocation.c",
      "source_sha256": "7bdfe0190c74de7593ebfa30d1b5a9f7d42bd2e6df522d7dcf747e91d2628db9",
      "functions": ["btrfs_reloc_post_snapshot"],
      "selection_kind": "near_neighbor",
      "selection_rationale": "Unseen relocation-related function in the v6.14 applicability window, distinct from construction function btrfs_recover_relocation.",
      "label_status": "unlabeled",
      "reviewer_slots": ["reviewer_a", "reviewer_b"],
      "allowed_verdicts": ["legal", "violation", "analysis_unknown", "out_of_scope"]
    },
    {
      "sample_id": "mocc.validation.b.clean_dirty_subvols.v6_14",
      "protocol_id": "mocc.protocol_b.device_topology_rollback",
      "candidate_rule_ids": ["mocc.rule.topology.relocation_root_rollback"],
      "filesystem": "btrfs",
      "source_version": "6.14",
      "source_path": "linux-sources/linux-v6.14-fs/fs/btrfs/relocation.c",
      "source_sha256": "7bdfe0190c74de7593ebfa30d1b5a9f7d42bd2e6df522d7dcf747e91d2628db9",
      "functions": ["clean_dirty_subvols"],
      "selection_kind": "near_neighbor",
      "selection_rationale": "Unseen cleanup helper in the same relocation source file, kept blind and separate from construction function identities.",
      "label_status": "unlabeled",
      "reviewer_slots": ["reviewer_a", "reviewer_b"],
      "allowed_verdicts": ["legal", "violation", "analysis_unknown", "out_of_scope"]
    },
    {
      "sample_id": "mocc.validation.c.ext4_try_to_expand_extra_isize.v6_14",
      "protocol_id": "mocc.protocol_c.activation_accounting",
      "candidate_rule_ids": ["mocc.rule.return.retry_current_attempt"],
      "filesystem": "ext4",
      "source_version": "6.14",
      "source_path": "linux-sources/linux-v6.14-fs/fs/ext4/inode.c",
      "source_sha256": "235f4d1ba3be429853e4cf75c11866121b7882b8311459a52c2c31a44cd2c887",
      "functions": ["ext4_try_to_expand_extra_isize"],
      "selection_kind": "near_neighbor",
      "selection_rationale": "Unseen ext4 retry-like function in the supported v6.14 rule window, selected without label access.",
      "label_status": "unlabeled",
      "reviewer_slots": ["reviewer_a", "reviewer_b"],
      "allowed_verdicts": ["legal", "violation", "analysis_unknown", "out_of_scope"]
    },
    {
      "sample_id": "mocc.validation.c.btrfs_chunk_alloc.v7_1",
      "protocol_id": "mocc.protocol_c.activation_accounting",
      "candidate_rule_ids": ["mocc.rule.accounting.pending_requires_reservation"],
      "filesystem": "btrfs",
      "source_version": "7.1",
      "source_path": "linux-sources/linux-v7.1-fs/fs/btrfs/block-group.c",
      "source_sha256": "edb8d5c0fc0fa2672b734e47e5a6a75ea38d4bf019dafae7c9bf37b1f25ae0db",
      "functions": ["btrfs_chunk_alloc"],
      "selection_kind": "near_neighbor",
      "selection_rationale": "Unseen btrfs chunk allocation entry in a pinned later source tree, distinct from development construction locators.",
      "label_status": "unlabeled",
      "reviewer_slots": ["reviewer_a", "reviewer_b"],
      "allowed_verdicts": ["legal", "violation", "analysis_unknown", "out_of_scope"]
    },
    {
      "sample_id": "mocc.validation.d.xfs_set_acl.v7_1",
      "protocol_id": "mocc.protocol_d.transaction_lifecycle",
      "candidate_rule_ids": ["mocc.rule.transaction.xfs.lifecycle"],
      "filesystem": "xfs",
      "source_version": "7.1",
      "source_path": "linux-sources/linux-v7.1-fs/fs/xfs/xfs_acl.c",
      "source_sha256": "228cdf0b83259f463e52c9b317b0a1937da2e2411b0da7f884258a2450622859",
      "functions": ["xfs_set_acl"],
      "selection_kind": "near_neighbor",
      "selection_rationale": "Unseen XFS ACL wrapper in the transaction lifecycle file, separated from construction operation xfs_acl_set_mode.",
      "label_status": "unlabeled",
      "reviewer_slots": ["reviewer_a", "reviewer_b"],
      "allowed_verdicts": ["legal", "violation", "analysis_unknown", "out_of_scope"]
    },
    {
      "sample_id": "mocc.validation.e.btrfs_get_name.v7_1",
      "protocol_id": "mocc.protocol_e.allocation_lifecycle",
      "candidate_rule_ids": ["mocc.rule.allocation.btrfs.search_path_release"],
      "filesystem": "btrfs",
      "source_version": "7.1",
      "source_path": "linux-sources/linux-v7.1-fs/fs/btrfs/export.c",
      "source_sha256": "f500e223b10c3e3bdd73d6f7ff46c3d9d1b7b1bd6576f46f237797ba546c0eb4",
      "functions": ["btrfs_get_name"],
      "selection_kind": "near_neighbor",
      "selection_rationale": "Unseen Btrfs export path function in the same source file as the allocation lifecycle evidence but not the construction entry btrfs_get_parent.",
      "label_status": "unlabeled",
      "reviewer_slots": ["reviewer_a", "reviewer_b"],
      "allowed_verdicts": ["legal", "violation", "analysis_unknown", "out_of_scope"]
    }
  ]
}
